449,"University of Rome tor Vergata, Rome, Italy"
450,"Harvard Medical School, Boston, MA, United States"
451,"Sorbonne University, Paris, France"
452,"Royal Swedish Academy of Sciences, Switzerland"
453,"Federal Institute of Drugs and Medical Devices, Bonn, Germany"
454,"University of Manchester, Manchester, United Kingdom"
455,"VA Ann Arbor Healthcare System, Ann Arbor, MI, United States"
456,"Wisconsin Alzheimer's Institute, Madison, WI, United States"
457,"Banner Sun Health Research Institute, Phoenix, AZ, United States"
458,"Swedish Medical Center, Seattle, WA, United States"
459,"Fred Hutchinson Cancer Research Center, Seattle, WA, United States"
460,"Mount Sinai Medical Center, Miami Beach, FL, United States"
461,"VA Medical Center, Portland, OR, United States"
462,"Cleveland Clinic, Cleveland, OH, United States"
463,"University of Virginia, Charlottesville, VA, United States"
464,"University of Malaga, Malaga, Spain"
465,"University of Granada, Granada, Spain"
466,"University of Texas at Austin, Austin, TX, United States"
467,"Peking University, Beijing, China"
468,"The Mental Health Research Institute, Parkville, VIC, Australia"
469,"Sir Charles Gairdner Hospital, Perth, WA, Australia"
470,"VA Northern California Health Care System, Sacramento, CA, United States"
471,"CIBER-BBN, Barcelona, Spain"
472,"Eisai Ltd, Hatfield, Hertfordshire, United Kingdom"
473,"Partners Center for Personalized Genetic Medicine, Boston, MA, United States"
474,"Janssen Pharmaceutica, Beerse, Belgium"
475,"Biogen IDEC, Cambridge, MA, United States"
476,"Synarc, Newark, CA, United States"
477,"ADM Diagnostics LLC, Chicago, IL, United States"
478,"Takeda Pharmaceuticals, Deerfield, IL, United States"
479,"CereSpir Inc, New York, NY, United States"
480,"Piramal Imaging, Boston, MA, United States"
481,"Otto-von-Guericke University, Magdeburg, Germany"
482,"German Center for Neurodegenerative Diseases, Magdeburg, Germany"
483,"Braunschweig University of Technology, Braunschweig, Germany"
484,"Louisiana State University, Baton Rouge, LA, United States"
485,"Regenstrief Institute, Indianapolis, IN, United States"
486,"Fordham University, Bronx, NY, United States"
487,"Pennington Biomedical Research Center, Baton Rouge, LA, United States"
488,"Arizona State University, Phoenix, AZ, United States"
489,"Fujian Medical University, Fuzhou, China"
490,"Pharnext, Ile de France, France"
491,"University of Bordeaux, Bordeaux, Aquitaine, France"
492,"Eisai Inc, Philadelphia, PA, United States"
493,"Ocean University of China, Qingdao, China"